,review,score
0,아기 안나가 너무 귀여워서 시작하자마자 울뻔했습니다 ㅠㅠ,10
1,완벽한 결말입니다. 안나 똑똑하고 솔직당당한거에 비해 주목을 못받는게 안타까웠었는데 완벽!한 결말!,10
2,노래가 넘 좋았어요마지막에 엘사 넘 예뻐용!!!,10
3,1편보다는 조금 아쉽지만 엘사가 2곡이나 불러줘서 좋았어요.노래보다는 아↗아↘아↗아↘ 가 더 기억에 남음.,9
4,"영상미에 놀라고 크리스토프때문에 웃다가 목소리 때문에 안타까움을, 할아버지에게서 인간의 본성을 보았다. into the unknown 부분에서의 엘사의 고뇌도 느꼈네. 너무 노래만 나오는 것 같아서 진부하다 생각했고, 30대인 나는 스토리가 보였지만 막상 보아하니 감동적이랄까? 전 편...",9
5,겨울왕국은 스토리면에서는 치밀하지는 못한 것 같다는 생각이 듭니다. 1편에서도 그렇고 스토리 전개가 개연성이 없는 면이 많죠. 정말 많은 부분에서 스토리 흐름이 우연적으로 진행되는 경우가 많네요. 가장 말도 안된다고 생각한 건 마법의 숲에 갇혀 있던 아렌델 병사들...어떻게 52년...,10
6,내가 지금 영화를 보는건지전국노래자랑을 보는건지 당췌 이해가 안가네,2
7,겨울왕국2 영화를 봤는데 너무 감동적이고 영화 스토리가 너무 좋았고 눈물도 흘리고 또 겨울왕국3 개봉헀으면 좋겠다 라는 생각을 들고 이번 영화 진짜 재미 있었습니다.,10
8,정말 제 마음을 감동시킨 환상의 영화인것 같습니다ㅠㅠ 어른이 된 저마저 동심의 세계로 빠져들게 하는 역대급 디즈니영화!,10
9,역시 1편을 넘지 못해서 아쉽네요...,6
10,영상미는 명불허전이고 캐릭터들의 개성도 여전히 좋았지만 극 흐름이 매끄럽지 못하고 개연성이 떨어짐. 가장 결정적인 문제는 메인 빌런이 아예 없다는 것인듯. 전편보다 어두운 분위기로 주인공들의 역경을 보여주려고 한거면 강력한 빌런을 넣어서 주요인물들이 패배하거나 살해...,6
11,전작만큼의 감동이나 명곡은 없음. 그치만 1편이랑 비교했을때 그렇다는거고 2편 자체는 꿀잼. 스토리 자체가 새로운 에피소드라기 보단 1편을 설명하는 느낌에 가깝고 안나가 아렌델 여왕된걸 보면 앞으로의 후속편을 위한 밑밥같기도 했음! 이렇게 된거 3편 4편 쭉 나왔으면 좋겠다,9
12,레딧고 만큼 기억에 남는 노래는 없지만 전작 재밌게 봤다면 만족스럽습니다. 사알짝 뭔가 사알짝 아쉬움이 남지만 간만에 겨울왕국 등장인물들 보니 옛날 친구보는 기분이고 재미있었어요 가장 기억에 남는건 올라프 1편요약 ㅋㅋ,9
13,1편에 비해 노래 과하게 많이 넣음. 근데 기억에 남는 노래는 딱히 없음. 스토리도 매력이 없고 뜬금없다고 느껴지는 스토리. 안나는 계속 엘사와 함께 하자고 하는데 1편과 마찬가지로 엘사는 안나를 밀어내고 동생 취급하는데 벗어나질 못함. 후속편인데 그래도 좀 달라진 모습 보여주...,5
14,물은 알고 있다!!! 우와~엘사여왕 신통력 쓰신다!!! 우와~그런데 전반적으로 영 와닿지는 않는다...굳이 볼 필요가 없는 후속편.,5
15,"1편을 너무너무 사랑하는 사람으로서 실망이 컸던 2편. 발전된 거라곤 영상미 하나 밖에 없다. 한층 진지하고 무게감 있는 이야기로 돌아왔지만 까보니 캐릭터들은 다 따로 놀고, 감정선은 따라가기 힘들고, 개연성과 설명이 부족한 설정 까지...차라리 유치할지언정 깔끔했던 1...",5
16,"인생영화....재탕하면 재탕할수록 빛이난다.렛잇고의 높은 벽을 넘지 못했지만 대부분의 테마가 그에 준하게 좋다.후련하기도 하고 아쉽기도 한 마무리였지만 개인적으로 토이스토리처럼 3,4가 나왔으면 좋겠다 싶은 영화",10
17,파도에 휩쓸려도 쓰러지지 않는 엘사. 왕국을 위해 힘차게 달리는 안나. 개인적으로 엘사의 코스튬이 레깅스로 바뀐 것에 박수를 보내고싶다.,9
18,엘사가 자신을 찾는 건 좋았지만 뜬금없구 힘이 부진한 스토리.. 하지만 넘나 예뿐 엘사온니ㅠㅠ 크리스토프 옛감성솔로가 젤 조흠,7
19,크리스토퍼 뮤비 장면 나왔을때 빵 터졌습니다ㅋㅋ,10
20,음악이 좋아요,9
21,오에스티와 올라프가 너무 좋았던 영화입니다,9
22,3D애니메이션의 끝판왕 아~아~아아!!! 다좋은데 특히 물의정령 말이 진짜 멋있었다,10
23,자다말고 고성방가로 동네사람들 다 깨우는 엘사 인성;;,7
24,엘사와 말 크리스토퍼의 뮤비만 기억에남음..,8
25,어른이봐도 좋을 애니메이션. 개인적으로 시즌2가 더 좋다. 얼음에 이어 물이라니. 말이나올때부터 이 영화에 매료됐다,9
26,말이 필요없는 영화 정말 굿!,10
27,"내용이 너무 재미있고, 아이들이 보기에 이해가 쉽게 번역이되어있어 좋아요",10
28,1편에 비해 연출이 더 뮤지컬스러워요. 안나 좌절했다 일어나는 부분 연출이 특히 그랬어요. 개연성은 솔직히 잘 모르겠는데 엘사가 예뻐요. 그래도 재미있어요.,8
29,어릴때부터 공주는 왕자를 만나서 오래오래 행복하게 사는게 행복의 결말이라고 생각했는데 어른이 된 지금여자가 왕이 되고 영웅도 될 수 있는 스토리를 만나서 무척 새롭고 기쁩니다. 저는 어른이 되고 뒤늦게 희망을 얻었지만 자라나는 아이들은 더욱 제약없는 꿈을 꿀 수 있겠...,10
30,너무 기대한 나머지 30분 정도로 느껴져서 다시 보고싶습니다 하유ㅠㅜ진짜 계속 노래듣고있고 엘사와 안나 너무 이뻐요ㅜㅜㅠ제 첫사랑은 엘사인거 같습니다 겨울왕국 3까지도 기달릴수 있어요 그리고 1때는 엘사가 안나를 녹이고 2편때는 안나가 엘사를 녹이는게 인상적이였네요 ...,10
31,어른아이할거없이 정말 무한감동입니다.엘사와 안나엄마가 엘사를 부를때 엘사가 5번째 정령이란 사실이 밝혀졌을때 살짝 눈물도 났어요 ㅎ 뮤지컬같은 느끼도 들고 환상입니다,10
32,1편에 이어 2편도 재밌게 봤어요~다 보고 나서 한참동안 노래가 머릿 속에 맴돌았어요~^^,10
33,아아~~~~아아~,7
34,최고 멋져요.최고 입니다.좋아요.감동.다시보고 싶어요.하나하나 에니메이션 션이 죽여줍니다.말 .나오는 장면 전 감동 이였어요,10
35,"마지막에 엘사가 아렌델 구할때, 우리나라 지도자가 엘사였으면 좋겠다는 생각이 들었다.",10
36,엘사는 이제 신이 되었다,10
37,아아아아~~아아아~~~`,9
38,올라프가 진짜 흑막입니다. 사악한 웃음에 속지 마세요.,10
39,울라프같은 반려동물 있었으면 당장 데려다가 키우고 싶을 정도로 사랑스러워요 ?,10
40,겨울왕국1 도 너무 감동적으로 봤지만 2도 너무나 감동적이고 또 보고싶네요,10
41,"영화관람후 엘사드레스,,안나드레스 구매ㅋㅋ",8
42,"무엇 하나 빠지지 않는 명작 판타지 애니메이션입니다. 두 번 보고 글 남깁니다. 디럭스판 음반이랑 DVD 살 거예요. 첫날 보고 너무 감동 받아서 다음 날 또 예매하고 봤네요.영상미, 음악, 캐릭터, 연출 등등 매우 감탄했습니다. 구혼의 어긋남이 억지 설정이라는 분들 : 결혼으로 가는 길은 ...",10
43,1편 못지않게 2편도 짜임새있는 내용이였고 중간중간에 ost곡들 나올 때 소름돋았네요. 특히나 저는 show yourself 곡 나왔을 때 감명깊게 느껴졌습니다.,10
44,엘사 머리푼거 존예,10
45,엘사랑 엄마의 노래 콜라보가 좋왔어요,10
46,"보는 내내 소리 질렀음,,, 부모님 서사부터 백마탄 엘사님까지 완벽한 조합",10
47,여러분! 겨울왕국은 그냥 엘사의 미모와 화려한 마법에 코피 터지는 영상과 어울리는 음악이면 되는겁니다! 역시 동서양을 막론하고 여왕님은 찬양해야 합니다. 연느님과 엘사 만만세!!! 겨울왕국 1이 '두려움의 극복' 이였다면겨울왕국 2는 '성장'이 핵심 키워드라 생각됩니다.into the unkn...,10
48,겨울왕국 1보다 다른 느낌을 받았다. 저절도 찡하게 느껴진다.,10
49,완전 짱!! 겨울왕국은 다 띵작임 ㅠㅠㅠ엘사 죽엇다가 다시 살아나는 건 진짜 안나가 완전 캐리했네,10
50,엘사가 성장하는 과정을 아름답게 그려서 보기 좋았습니다. 노래 굿,9
51,너무재미있어요 1도 좋은테 2더좋네요또보고싶은영호내요뮤직컬 노래들이 좋아요겨울 왕국3도 보고싶네요 기대돼네요,10
52,아이와 보기에도 어른이 보기에도 정말 잼납니다!!! 최고에유우~~~,10
53,저를 포함해 개봉 첫 날인 어제 극장을 찾으신 분들은 겨울왕국을 애정하는 분들 또는 굿즈 쟁탈전에 참전하신 분들일 것으로 생각됩니다. 저는 음악적인 측면에서의 완성도를 느끼고 싶은 마음에 메박 MX관을 찾았는데 디즈니 영화와 이 포맷의 합이 좋지 않다는 세간의 평가가 틀리지...,7
54,겨울왕국1편도재밌어서5번봤는데이건10번넘게볼수있을정도로재밌고 노래가완전대박임이영화대박추천 마지막엘사가머리푼거찐대박!!재밌었던사람은좋아요를!,10
55,친구들이 엘시 죽는다고 해서 걱정했는데!! 안 죽어서 다행이네요!!,10
56,Show yourself 가 완전 대박임,10
57,기대 안하고 봤는데 전작보다 섬세하고 성숙해짐이 느껴져서 기분좋게 관람하였습니다 계속 흥얼거리던 into the unknown~*,10
58,영웅이 된 엘사와 여왕이 된 안나!!! 정말 재밌게 보았습니다ㅠㅠ,10
59,넘넘 짱 진짜 늦더라도 꼭 보세요!!,10
60,아이들과 재미있게 잘봤어요 쵝오^^,10
61,영화를 야무지게 잘만들었어요~굿굿,10
62,올라프 미쳤다.,10
63,겨울왕국1도 재미있었는데겨울왕국2도 너무 재미있어요 너무감동이에요ㅠㅠ,10
64,"You will always have me.Let down your guard.Love, warm hugs.Do the next right thing.",10
65,와 OST가 너무 좋네요,10
66,가족을 한번 더 생각 해주었어요. Show yourself 약간 울컥 했어요. 극장문 닫기 전에 무조건 극장에서 보세요. 이건 무조건,10
67,Show yourself 장면은 디즈니 역대 영화 장면 1순위이다.,10
68,"엘사가 5번째 얼음정령이고 엘사가 계속해서 의문의 목소리를 찾아다닌다. 바로 그 의문의 목소리는 엘사의 어머니의 목소리였다. 엘사가 안나,크리스토프,스벤,올라프와 함께 의문의 목소리를 찾으러 마법의 숲으로 들어가서 4정령을 만난다. 4정령은 불의정령 브루니, 물의정령 나크, ...",10
69,영상멋짐 재미남~ OST 최고,10
70,겨울왕국 더빙 아이맥스 슈퍼4dx 로 여자친구랑단둘이봤는데 보는사람이 저랑 여자친구 단둘밖에없어서 겨울왕국2 에서 크리스토프가 안나한태청혼하는 장면에서 여자친구한태청혼했더니 청혼받아줬습니다 애인끼리보기좋은 영화입니다30대 20대 한태추천 여러분도 겨울왕국2보...,10
71,저는 넘 잼있게 봤네요엘사 여왕님 멋져요~♥♥♥,10
72,잘봤습니다~^^안보면 아싸될것 같아 봤네요ㅎ,10
73,엘사너무예쁘요~~말타는장만 너무멋졌요^^,10
74,엘사가 show yourself 하는 부분이 정말 인상적이었다,9
75,스토리는 1이 재미있고 영상미는 2가 좋아요솔직히말해서 중간중간 재미없던 부분도있고 노래도 임팩트있는게 별로 없었어요 그래도 올라프가 너무 귀여웠고 올라프가 스토리 요약할땐 넘 귀여웠네요,8
76,기대보다 더 괜찮았어요ㅡ더빙판도 좋아요,10
77,"먼저 요약하자면, 영화 전반이 시각적인 아름다움은 전편보다도 극대화 되어있습니다. 문제는 다른 것이 다소 부족한 느낌이에요. 1편에서의 ost 대박을 의식해서인지 노래가 많아졌는데 막상 꽂힐 만한 트랙은 없고 노래의 갯수가 많아지기만 해서 좀 산만한 감이 있어요. 문제는 스토리...",7
78,내나이 칠순 올라프 사라지는거 보고 눈물흘림,10
79,엘사가 어둠의 바다인가? 거기 달리면서 막 아이스마리오마냥 발에서 얼음나오면서 계속 달리고 나중에 말타고 달리는 장면이 글케 감동적...ㅠㅠㅠ 눈물이 핑 돌더라 되게 멋있었음,10
80,올라프가 안나 얼때 설명하는데 그 아렌델 군인(?)이 ''오... 안나..ㅠ''하는게 제일 재밌음,10
81,"극중 사건들이 빠르게 전개되는 편이라 한번 보니 이해가 안 가거나 놓치는 부분이 많더라구요~ 그래서 저는 네번 봤어요! OST도 매일 듣고 있는데 노래를 아니까 N차 관람 때는 속으로 따라부르게 되네요 ㅋㅋ 풍부해진 캐릭터들의 표정 연기, 옷 질감, 머리카락, 등등 특히 마지막에 ...",10
82,다 됐고 엘사가 한스 부셔서 통쾌함,10
83,진짜 겨울왕국1은 마법때문에 힘들어하는 엘사를 그렸다면 겨울왕국 2편은 마법의 원천을 찾아 떠나는 내용인지라 1편 나올 때 봤던 꼬맹이들이 지금쯤 사춘기 시절이 되서 2편에서 심층적이고 깊은 내용을 공감할 수 있는 스토리로 만든 것 같다.,10
84,"진짜 영상보면서 너무 좋은게 마지막에 엄마랑 같이부른 show yourself가 너무 감동적이였고 이것 볼때도 너무 좋았어요 이것만 유튜브에 쳐서 듣고있어요, 진짜 겨울왕국3도 내년에 생각하신다고 했는데 아직은 희망이있어서 너무 좋네요, 생각하시고 겨울왕국3 만들어 주세요, 감사합니...",10
85,너무 좋았어요 저 올라프 사라질 때 같이 울었어요ㅠㅠ ost부터 스토리 연출 모두 다 넘 좋아요,10
86,엘사가 숨겨진세상노래 부르는게 제일좋네요.안나가 여왕이되는게 인상깊었어요.겨울왕국3나오면좋겠어요~~,10
87,노래가 너무 좋아서 맨날 듣고 싶어요.,10
88,실망스럽지 않았다~~굿,9
89,그냥 너무 재미있다!!!! 초딩때 1편 보고 이제 고3올라가는데 올라프 날라갈때 울뻔했다ㅠㅠ,10
90,친구들이 엘시 죽는다고 해서 걱정했는데!! 안 죽어서 다행이네요!!,10
91,다시보고싶은 디즈니영화,10
92,"지루하다는 사람들 노이해영상미 음악 스토리 다 좋았음 크리스토프 뮤비빼고..ㅋ엘사 물의정령 타고 아토할란으로 달릴때 개소름 영상미가 ㅎㄷㄷ""Show yourself"" 부르는 장면이 킬링포인트임벌써 5번 봤드아... 휴 또 볼꺼임♡",10
93,원더풀!ㅑ6ㅅ류샤려폇8류,10
94,"2편 연출,연기,스토리,영상미,ost 다좋았음 안나처럼 자신감을갖고, 스스로 해결하는게 멋지고 감동적임",10
95,Into the unknown~~^^,10
96,떡밥수거 bb,10
97,드디어 봤네요 너무 감동적입니다.초1아들과 봤는데 어른이나 아이나완전재밌다고 엄지척입니다!다시 한번 보고싶네용♡,10
98,재미나게 보았네요기대한만큼 내용이 꽉차지는않았지만영상미 좋았습니다,10
99,한스는 이래저래 흑역사인데 나올때마다 웃기네요 ㅎ,8
100,1편이 좀낫고 노래가너무많음 뮤직비디오 수준,6
101,1편이 그냥 엘사가 가출했다 돌아온 이야기였다면 2편은 엘사의 존재와 아렌델의 과거 모든 게 다 밝혀지고 일이 해결이 된 이야기라 훨씬 좋았다 어쩐지 아렌델에서 엘사가 뭔가 답답해보이는 이유가 있었음 엘사가 자신의 존재를 찾고 자신에게 맞는 곳에서 진짜 자기 모습으로살게 되...,10
102,크리스토퍼~~ 그런 감성이 에니메이션에서 표현할 수 있다는게 너무너무 멋져요~~,10
103,엘사가 말타고 달리던 장면 잊을수가 없네요ㅠㅠ퀸갓엘사ㅠㅠ,10
104,진짜 이거보고 하ㅠㅜㅜㅠ 역시 겨울왕국엘사가 엄마랑 Show your self 부를때 I am found 할때ㅠㅠㅠㅠ 진심 감덩 또 안나가 엘사 얼어서 올라프 사라졌을때 동굴에서 부르는 노래도 한몫하고 1편에 나왔던 부모님 배타고 돌아가실때 숨은거엘사 부모님이 서로이름부르며 껴안는거 진...,10
105,겨울왕국 전시리즈 전부 다봤는데요 역시 겨울왕국 시리즈는 월드디지니 회사의 탑중에탑이네요 이번에도 안나와엘사 노래가 너무 좋았고요 그래픽 스토리 빠짐없이 전부 좋았어요 그리고 자매들의 우정너무 눈물겨웠고요 안나가 결혼하고 아렌델 왕국의 왕이되어서 좋았어요 너무 잼...,10
106,올라프피셜 엘사는 음치다,10
107,첫 장면부터 과거에 엘사네 가족이 재밌게 지내는 것 보고 눈물 고이고 시작했다.. 엘사가 1에 이어서 계속 자기의 일상을 지키고 만족하지만 한편으로 자기의 능력에대한 고민과 부담감을 속으로만 삭히고 있었다는기 in to the unknown으로 터지는데 영문판 가사가 너무 슬퍼서 눈물 ...,10
108,스토리 전반 괜찮고 크리스토프 약간 슬픔 ㅋㅋ,10
109,엘사 너무예쁨♡♡♡♡,10
110,엘사 머리푼것도 넘 이쁘고 into the unknown 대박이고 show your self 도 눈물나고 너무 좋아요,10
111,렛잇고를 뛰어넘는 in to the unknown! 스토리가 정말 감동적이고 재밌어요!벌써 3번이나 본 나님...ㅎㅎ겨울왕국2 사랑해♡♡♡,10
112,올라프공식:물은 모든것을 알고있다올라프가 정말 중요했던시점엘사 이쁘다,10
113,올라프랑 엘사 죽을때 마음이 찢어지는 줄 알았습니다..,8
114,겨울왕국 2가 1000만관객을 찍으니 기분좋고 예상은 1250만정도입니다. INTO THE UNKNOWN!,10
115,크리스토퍼 뮤비보고 남편이랑 개웃 ㅋㅋ올라프 헛소리도 취저 ㅋㅋㅋ,9
116,1편에 비하면 확 꽂히는 곡도 없고..(인간순록의 히트송 제외) 하지만 안나를 생각하면 가슴이 뻐근하니 5점드립니다,10
117,황홀했고 아름다웠어요. 크리스토프 혼자 노래하는신이 조금 진부 했어요~,10
118,"시리즈물은 2편에서 실망하기 마련인데, 역시 겨울왕국은 그걸 깨부셔주었습니다. 이번에도 애니메이션이지만 정말 성인까지도 마음 깊히 와닿을 수 있는 특유의 교훈은 감동이었네요. 엘사의 마법에 관한 떡밥을 풀어주는 것이 상당히 깔끔했고, 3편은 아마 한스가 나오지 않을까...",10
119,역시 겨울왕국. 초등생 딸도 저도 재밌게 봤어요,8
120,딸래미들 보여주기 위해 같이 본 건데 올라프 사라질 때 주책맞게 펑펑 울었어요ㅠㅠ,10
121,"1편의 중점은 안나 였다면, 2편의 중점은 엘사입니다.'Into the known(숨겨진세상)' 과 'Show yourself(보여줘)'가 그런 것이죠.숨겨진 세상은 처음부터 엘사에게 들려오는 의문의 소리때문에 힘겨운 것을 표현하고, 보여줘는 아토할란에 도착하여 자신의 힘이 왜 생겨났는지 어째서 자신이어...",10
122,겨울왕국 나이브스 아웃 라스트 크리스마스 크롤 중에 ..,8
123,초반에는 내용 이해가 바로 풀리진 않았지만 나중에 가니까 내용이 재미있어지고 ost도 감동적이었어요,9
124,물 말을 길들이는건 처음 봤는데 정말 멋지더라구요 이런 장면은 겨울왕국에서밖에 못봄,8
125,또 보고 싶어요~~,10
126,불의 정령...너무 귀엽고 영상미가 매우 뛰어납니다.,9
127,결국 원소술사 럭스 되는 그런 이야기죠?,9
128,"만들어줘서 고마워요~ 부모가 엘사를 위해 무언가 했다는 것에 감동 받았어요~ 처음엔 all is found가 귀에 들어왔다가 into the unknown에 소름이~ 그러다 show yourself에 감동.. 하지만, 지나고 보니 자꾸 the next right thing이 귀에 들어와요~",10
129,본격 4대강 보 해체 주장 영화,7
130,세계관 표현과 1편 이상의 영상(엘사 show yourself부분)ㄷㄷ..디즈니 영화로서의 모든걸 다했다고 볼수있음. 3편이 나올진 모르겠지만 개인적으로 기대해봅니다.,10
131,재미있었습니다,9
132,겨울왕국2가 좋은점: 엘사 개 이뻐짐 엘사 능력 제대로 나옴 귀여운에 추가(브루니)글고 ost는 영상으로 봐야 개쩜(show yourself는 진짜 영상으로 보면암) 내가 1은 한번 봤는데 겨울왕국2는 7번 본 ㄹㅈㄷ 글고 크리스토프는 고냥 반해서림 올라프는 약간 상황 전개 바뀔때 뭔가 알려줌...,10
133,엘사가 물의 정령을 길들이고 지극히 평온하게 달릴 때 눈물났다.,8
134,1편에비해 너무 음악이많음 그렇다고 와 이노래다싶은 음악도 없고 아이들의 기대치만 높여놓은듯,4
135,1보다 훨씬 재밌고 웃기고 감동적이에요.. 그리고 노래는 렛잇고를 과연 넘길수 있을까 생각했는데 그걸 뛰어넘어 버립니다... 꼭 보세요....아~~~아~~~~아~~아~~무슨소리 못들었어요.???,10
136,좋아요 좋아요 ㅎㅎ 재밋어요,7
137,벌써 3번째 관람...!너무 재밌고 슬프면서도 성장해가는 엘사와 안나를 보고 좋았어요. 중간 크리스토프의 뮤지컬.... 너무 웃겼어요. 또 보고 싶네요!,10
138,영상은 진짜진짜 화려하고 예쁜데 스토리는 1편보다 못하네요... 반전도 뻔한데 이거야 애들용이니까 그렇다 치는데 마지막에 엘사가 왜;;;진짜 감정이입 할만한 애라곤 크리스토프밖에 없네요. 프로포즈 성공한게 최고의 감동;;,6
139,"10 내평점한층 더 예뻐진 엘사와 성숙해진 안나, 그리고 여전히 귀엽고 재밌는 올라프와 멋있는 크리스토프, 또 말하는 스벤까지....역시 디즈니는 사랑입니당ㅋㅋㅋ ost도 렛잇고에는 못미치지만 최고였어용3편도 기대해봅니당~~~~",10
140,솔직히 1편에 비해 정말 별로였음. 사건 발화되는 것 부터 너무 갑작스럽고 억지로 낀 것 같은 느낌이 듬. 또 영화를 볼때 절정의 순간이 빠진 것 같아 밍밍함. 겨울왕국1은 그 과정이 좀 탄탄했던 것 같은데 2는 1같은 긴장감도 없고 그 때문인지 마지막에 문제해결됬을 때 이렇게 쉽게 끝...,4
141,이거 드래곤길들이기인줄알았다...스토리도 참 거지같다 왠만하면 이런평안하는데 전작 유명세 이용해서 표팔아먹은거같음,2
142,1학년 둥이들이랑 같이 봤는데 애들은 완전 잼있었다고 하네요.. 저는 그냥 그랬던것 같아요. 확실히 겨울왕국1이 더 감동이도 잼있었어요.. 너무 기대를 하고 봐서 그런지 스토리가 약간 별루였어요.영화가 끝나고 드는 생각은 겨울왕국이 아니라 가을왕국같다 였어요^^;;;,6
143,생각보다 재미있었어요 저는 개인적으로2보다 1이 더 재미나네요 ㅎ,8
144,영상미는 굉장히 좋아진게 느껴짐하지만 고질적 문제인 디즈니의 급전개방식 + 겨울왕국 1편의성공때문인지 과도한 뮤직 삽입 이놈저놈 다챙겨줄려다가 영상미만 좋고 되려 산만함 가중/ 뭘 말하고 싶은건지 도대체 모르겠음 나머지는 이도저도 안되는 느낌 발생 그리고 처음부터 도대...,4
145,단순한 스토리 어떻게든 벅차보이게 하려고 무진장 애쓴 느낌..전개가 정신없고 중간에 크리스토퍼 뮤비는 무엇?ㅋ어차피 마법으로 모든걸 해결할거면서 난관을 만들어놓고바위거인 나타나고 댐 얘기할때부터 아.. 부수겠구나..기억나는 OST도 없는데 노래는 왜이렇게 많이 불러ㅜ보...,6
146,1. 개연성이 낮음 (갑자기 엘사가 얼어버린다던가 방금터진 댐은 요깄는데 저~기 있던 엘사가 말타고 와서 막음) 안나가 엘사 위기를 알게되는 장면도 사실 마법이여서 다됨ㅋ 이런느낌2. 결과가 허무함: 물 난리? 그거 그냥 마법 한방이면끝임 ㅋ이러고 사실 다 사랑이였어~사랑이면 다...,3
147,"어린이들보다는 어른이들을 위한 영화인 것 같네요. 안나의 모습을 통해 아주 절망적인 상황에서도 지금의 내가 해야하는 일들을 계속해나가야 하는 어른들의 마음을 보여주는 것 같아요. 엘사를 보면서 인간이 가지는 자신의 근원에 대한 궁금증, 자신을 이해하고 받아들이기 위...",9
148,너무 재미있어서 좋아요,10
149,겨울왕국ost 음악이 나오게 해주고DVD도 나와서 겨울왕국2하고 열기도보내주면 감사합니다,10
150,너무너무 재미있었어요. 특히 엘사가 아토할란 에서 노래부를때 제일 좋았어요,10
151,겨울왕국 2 교훈은 사람은 자신의 잘못을 인정하고 잘못에 대한 책임을 질 줄 알아야 한다 ?,10
152,아무래도 영상미가 압권이었죠겨울왕국인데 눈 장면은 많이 안 나왔지만..그래도 훌륭~,8
153,스토리와 ost모두 그리고 연출도 짱!!완벽하네요!!,10
154,진짜 엘사 너무 예쁘고.. 스토리도 재밌고.. 노래도 좋았어요!,10
